{
  "agent_name": "consumer_agent",
  "score": 7,
  "pass": true,
  "problem_list": [
    "海报具有秋季氛围，但没有建立保温杯与通勤携带的实际使用联系",
    "600 mL容量已经出现，但没有转化为容易理解的日常便利利益"
  ],
  "modify_suggestion": [
    "增加手持、包袋或城市移动线索，建立商品与通勤车载场景的使用关系",
    "保留600 mL信息并补充简短的通勤随身利益表达，不增加未经输入支持的重量或保温时长"
  ],
  "protected_content": [
    "NORI保温杯商品主体",
    "600 mL容量",
    "不锈钢材质",
    "正确的价格文案"
  ],
  "meta": {
    "judge_dimensions": [
      "商品与品牌识别",
      "消费利益与卖点传达",
      "价格促销与活动信息",
      "人群与场景适配",
      "购买信心与行动驱动"
    ],
    "confidence": 0.9
  }
}
